{
  "source": {
    "id": "src-1111-aaaa-bbbb-cccc-000000000001",
    "document_id": "doc-1111-aaaa-bbbb-cccc-000000000001",
    "origin": "ingest.pipeline.v4",
    "author": "Lydia Scholar",
    "year": 2021,
    "url": "https://example.org/articles/theology-of-hope",
    "modality": "text",
    "meta": {
      "collection": "theo-journal",
      "language": "en"
    },
    "created_at": "2024-05-01T12:00:00Z",
    "updated_at": "2024-05-01T12:00:00Z"
  },
  "objects": [
    {
      "id": "obj-1111-aaaa-bbbb-cccc-000000000001",
      "source_id": "src-1111-aaaa-bbbb-cccc-000000000001",
      "document_id": "doc-1111-aaaa-bbbb-cccc-000000000001",
      "passage_id": "passage-aaaa-1111",
      "object_type": "passage",
      "title": "Romans 5:3-5",
      "body": "We rejoice in our sufferings, knowing that suffering produces endurance...",
      "osis_ranges": ["Rom.5.3-Rom.5.5"],
      "modality": "text",
      "tags": ["hope", "endurance"],
      "embedding": [0.11, 0.52, -0.03],
      "stability": 0.92,
      "meta": {
        "translation": "ESV"
      },
      "published_at": "2021-04-01T00:00:00Z",
      "created_at": "2024-05-01T12:00:00Z",
      "updated_at": "2024-05-01T12:00:00Z"
    },
    {
      "id": "obj-1111-aaaa-bbbb-cccc-000000000002",
      "source_id": "src-1111-aaaa-bbbb-cccc-000000000001",
      "document_id": "doc-1111-aaaa-bbbb-cccc-000000000001",
      "object_type": "claim",
      "title": "Suffering nurtures resilient hope",
      "body": "The article argues that perseverance under trial forms mature hope in the church.",
      "modality": "text",
      "tags": ["analysis"],
      "embedding": [0.08, 0.47, 0.10],
      "stability": 0.81,
      "meta": {
        "summary_model": "gpt-4o-mini"
      },
      "created_at": "2024-05-01T12:00:00Z",
      "updated_at": "2024-05-01T12:00:00Z"
    }
  ],
  "edges": [
    {
      "id": "edge-1111-aaaa-bbbb-cccc-000000000001",
      "src_object_id": "obj-1111-aaaa-bbbb-cccc-000000000001",
      "dst_object_id": "obj-1111-aaaa-bbbb-cccc-000000000002",
      "kind": "semantic_sim",
      "weight": 0.87,
      "features": {
        "cosine_similarity": 0.87,
        "token_overlap": 14
      },
      "created_at": "2024-05-01T12:00:00Z",
      "updated_at": "2024-05-01T12:00:00Z"
    }
  ],
  "insights": [
    {
      "id": "insight-1111-aaaa-bbbb-cccc-000000000001",
      "primary_object_id": "obj-1111-aaaa-bbbb-cccc-000000000002",
      "insight_type": "convergence",
      "score": 0.91,
      "cluster_id": "cluster-hope-2024-05-01",
      "payload": {
        "supporting_object_ids": ["obj-1111-aaaa-bbbb-cccc-000000000001"],
        "edge_ids": ["edge-1111-aaaa-bbbb-cccc-000000000001"],
        "why": "Semantic similarity over 0.85 with fresh supporting passage."
      },
      "created_at": "2024-05-01T12:00:00Z",
      "updated_at": "2024-05-01T12:00:00Z"
    }
  ],
  "user_actions": [
    {
      "id": "action-1111-aaaa-bbbb-cccc-000000000001",
      "insight_id": "insight-1111-aaaa-bbbb-cccc-000000000001",
      "action": "accept",
      "confidence": 0.8,
      "payload": {
        "note": "Matches sermon planning focus."
      },
      "created_at": "2024-05-02T09:30:00Z",
      "updated_at": "2024-05-02T09:30:00Z"
    }
  ]
}
